{
  "fieldId": "issuerName",
  "value": "Goldman Sachs Incorporated",
  "valueType": "string",
  "status": "found",
  "confidence": 0.95,
  "sourceId": "src1",
  "reason": null,
  "citations": [
    {
      "mergedPage": 3,
      "boxes": [{ "x": 72.0, "y": 144.5, "w": 180.25, "h": 12.0 }],
      "quote": "Goldman Sachs Incorporated",
      "sourceId": "src1",
      "sourcePage": 1
    }
  ]
}
